<?xml version="1.0" encoding="UTF-8"?>
<xsd:schema xmlns:xsd="http://www.w3.org/2001/XMLSchema" elementFormDefault="qualified" xmlns:dflt="ibank_test">
	<xsd:import namespace="ibank_test" schemaLocation="ibank_test.xsd" />
	<xsd:element name="dataset">
		<xsd:complexType>
			<xsd:choice minOccurs="0" maxOccurs="unbounded">
				<xsd:element name="users" type="dflt:users__type" />
				<xsd:element name="accounts" type="dflt:accounts__type" />
				<xsd:element name="archive" type="dflt:archive__type" />
				<xsd:element name="operations" type="dflt:operations__type" />
				<xsd:element name="role" type="dflt:role__type" />
				<xsd:any namespace="ibank_test" />
			</xsd:choice>
		</xsd:complexType>
	</xsd:element>
</xsd:schema>